{
  "$schema": "https://json-schema.org/draft/2020-12/schema",
  "$id": "https://reward-lens.github.io/schemas/refusals.schema.json",
  "title": "Refusal reference",
  "description": "The seventeen refusal reasons, from reward_lens.core.reading.RefusalReason and REASON_MEANING, with the library's own remedy for each. Generated by scripts/build_catalogue.py. Seventeen and not sixteen: GROUND-TRUTH.md C-10 records that the library's own kernel page is one amendment behind, and two acceptance tests pin the enum at seventeen. A refusal is a value and a success in this library's semantics; nothing reading this file may style one as an error (HANDOFF.md rule 4).",
  "type": "object",
  "additionalProperties": false,
  "required": [
    "counts",
    "reasons",
    "remedySort",
    "trustLadder",
    "provenance"
  ],
  "properties": {
    "counts": {
      "type": "object",
      "additionalProperties": false,
      "required": [
        "reasons",
        "sorted",
        "unsorted"
      ],
      "properties": {
        "reasons": {
          "type": "integer",
          "minimum": 1
        },
        "sorted": {
          "type": "integer",
          "minimum": 0
        },
        "unsorted": {
          "type": "integer",
          "minimum": 0
        }
      }
    },
    "reasons": {
      "type": "array",
      "minItems": 1,
      "items": {
        "type": "object",
        "additionalProperties": false,
        "required": [
          "name",
          "meaning",
          "whatToDo",
          "remedy"
        ],
        "properties": {
          "name": {
            "type": "string",
            "pattern": "^[A-Z][A-Z_]+$"
          },
          "meaning": {
            "type": "string",
            "minLength": 1
          },
          "whatToDo": {
            "type": "string",
            "minLength": 1,
            "description": "Required, never optional. A refusal without a remedy is a tool that looks broken instead of a tool that looks honest, and guards.mjs requireRemedy throws on one."
          },
          "remedy": {
            "type": [
              "object",
              "null"
            ],
            "description": "Non-null on exactly the three reasons the library itself sorts. DECISIONS.md D-09: the mapping exists for three of seventeen and there is no code structure assigning a group to the other fourteen, so null is the honest value. Inventing fourteen classifications would be the site asserting a taxonomy its own subject does not hold, on the page whose subject is not asserting things you cannot support.",
            "additionalProperties": false,
            "required": [
              "remedy",
              "answerable",
              "answerableLabel"
            ],
            "properties": {
              "remedy": {
                "type": "string",
                "minLength": 1
              },
              "answerable": {
                "enum": [
                  "here",
                  "upstream",
                  "nowhere"
                ]
              },
              "answerableLabel": {
                "type": "string",
                "minLength": 1
              }
            }
          }
        }
      }
    },
    "remedySort": {
      "type": "object",
      "additionalProperties": false,
      "required": [
        "question",
        "note",
        "locations"
      ],
      "properties": {
        "question": {
          "type": "string"
        },
        "note": {
          "type": "string"
        },
        "locations": {
          "type": "array",
          "items": {
            "enum": [
              "here",
              "upstream",
              "nowhere"
            ]
          }
        }
      }
    },
    "trustLadder": {
      "type": "array",
      "minItems": 1,
      "description": "The library's TrustLevel enum, in rung order. The four display names come from copy.yaml:trust_ladder and never from a component; this file carries the enum, not the prose.",
      "items": {
        "type": "object",
        "additionalProperties": false,
        "required": [
          "rung",
          "name"
        ],
        "properties": {
          "rung": {
            "type": "integer",
            "minimum": 0
          },
          "name": {
            "type": "string",
            "minLength": 1
          }
        }
      }
    },
    "provenance": {
      "type": "object",
      "additionalProperties": false,
      "required": [
        "generatedBy",
        "libraryVersion",
        "librarySource",
        "quantitySource",
        "skippedModules"
      ],
      "description": "Which library this was read from. A libraryVersion below 3.0.0 means the generator ran under the wrong venv and every count is a v2 count; build_catalogue.py refuses that case rather than emitting it. skippedModules names the modules a missing optional extra kept out of the walk, and it is not decoration: an estimator registers when its module imports, so a skipped module makes its quantities read as open. A reader who is told which extras were missing can tell 'nobody has built this' from 'this build could not see it'.",
      "properties": {
        "generatedBy": {
          "const": "scripts/build_catalogue.py"
        },
        "libraryVersion": {
          "type": "string",
          "pattern": "^[0-9]+\\.[0-9]+\\.[0-9]+"
        },
        "librarySource": {
          "type": "string"
        },
        "quantitySource": {
          "type": "string"
        },
        "skippedModules": {
          "type": "array",
          "items": {
            "type": "string"
          }
        }
      }
    }
  }
}
